<?xml version="1.0" encoding="UTF-8"?>
<dictionary-elements xmlns="urn:hu.sztaki.ilab.longneck:1.0"
  xmlns:xsi="http://www.w3.org/2001/XMLSchema-instance"
  xsi:schemaLocation="urn:hu.sztaki.ilab.longneck:1.0 ../dictionaryFileSource.xsd">

  <!-- Source : http://en.wikipedia.org/wiki/URI_scheme -->

<element>
  <key>aaa<\key>
  <val>aaa<\val>
<\element>

<element>
  <key>aaas<\key>
  <val>aaas<\val>
<\element>

<element>
  <key>about<\key>
  <val>about<\val>
<\element>

<element>
  <key>acap<\key>
  <val>acap<\val>
<\element>

<element>
  <key>cap<\key>
  <val>cap<\val>
<\element>

<element>
  <key>cid<\key>
  <val>cid<\val>
<\element>

<element>
  <key>crid<\key>
  <val>crid<\val>
<\element>

<element>
  <key>data<\key>
  <val>data<\val>
<\element>

<element>
  <key>dav<\key>
  <val>dav<\val>
<\element>

<element>
  <key>dict<\key>
  <val>dict<\val>
<\element>

<element>
  <key>dns<\key>
  <val>dns<\val>
<\element>

<element>
  <key>fax<\key>
  <val>fax<\val>
<\element>

<element>
  <key>file<\key>
  <val>file<\val>
<\element>

<element>
  <key>ftp<\key>
  <val>ftp<\val>
<\element>

<element>
  <key>geo<\key>
  <val>geo<\val>
<\element>

<element>
  <key>go<\key>
  <val>go<\val>
<\element>

<element>
  <key>gopher<\key>
  <val>gopher<\val>
<\element>

<element>
  <key>h323<\key>
  <val>h323<\val>
<\element>

<element>
  <key>http<\key>
  <val>http<\val>
<\element>

<element>
  <key>https<\key>
  <val>https<\val>
<\element>

<element>
  <key>iax<\key>
  <val>iax<\val>
<\element>

<element>
  <key>icap<\key>
  <val>icap<\val>
<\element>

<element>
  <key>im<\key>
  <val>im<\val>
<\element>

<element>
  <key>imap<\key>
  <val>imap<\val>
<\element>

<element>
  <key>info<\key>
  <val>info<\val>
<\element>

<element>
  <key>ipp<\key>
  <val>ipp<\val>
<\element>

<element>
  <key>iris <\key>
  <val>iris <\val>
<\element>

<element>
  <key>iris.beep <\key>
  <val>iris.beep <\val>
<\element>

<element>
  <key>iris.xpc <\key>
  <val>iris.xpc <\val>
<\element>

<element>
  <key>iris.xpcs <\key>
  <val>iris.xpcs <\val>
<\element>

<element>
  <key>iris.lws<\key>
  <val>iris.lws<\val>
<\element>

<element>
  <key>ldap<\key>
  <val>ldap<\val>
<\element>

<element>
  <key>mailto<\key>
  <val>mailto<\val>
<\element>

<element>
  <key>mid<\key>
  <val>mid<\val>
<\element>

<element>
  <key>modem<\key>
  <val>modem<\val>
<\element>

<element>
  <key>msrp <\key>
  <val>msrp <\val>
<\element>

<element>
  <key>msrps<\key>
  <val>msrps<\val>
<\element>

<element>
  <key>mtqp<\key>
  <val>mtqp<\val>
<\element>

<element>
  <key>mupdate<\key>
  <val>mupdate<\val>
<\element>

<element>
  <key>news<\key>
  <val>news<\val>
<\element>

<element>
  <key>nfs<\key>
  <val>nfs<\val>
<\element>

<element>
  <key>nntp<\key>
  <val>nntp<\val>
<\element>

<element>
  <key>opaquelocktoken<\key>
  <val>opaquelocktoken<\val>
<\element>

<element>
  <key>pop<\key>
  <val>pop<\val>
<\element>

<element>
  <key>pres<\key>
  <val>pres<\val>
<\element>

<element>
  <key>prospero<\key>
  <val>prospero<\val>
<\element>

<element>
  <key>rsync<\key>
  <val>rsync<\val>
<\element>

<element>
  <key>rtsp<\key>
  <val>rtsp<\val>
<\element>

<element>
  <key>service<\key>
  <val>service<\val>
<\element>

<element>
  <key>shttp<\key>
  <val>shttp<\val>
<\element>

<element>
  <key>sieve<\key>
  <val>sieve<\val>
<\element>

<element>
  <key>sip<\key>
  <val>sip<\val>
<\element>

<element>
  <key>sips<\key>
  <val>sips<\val>
<\element>

<element>
  <key>sms<\key>
  <val>sms<\val>
<\element>

<element>
  <key>snmp<\key>
  <val>snmp<\val>
<\element>

<element>
  <key>soap.beep <\key>
  <val>soap.beep <\val>
<\element>

<element>
  <key>soap.beeps<\key>
  <val>soap.beeps<\val>
<\element>

<element>
  <key>tag<\key>
  <val>tag<\val>
<\element>

<element>
  <key>tel<\key>
  <val>tel<\val>
<\element>

<element>
  <key>telnet<\key>
  <val>telnet<\val>
<\element>

<element>
  <key>tftp<\key>
  <val>tftp<\val>
<\element>

<element>
  <key>thismessage<\key>
  <val>thismessage<\val>
<\element>

<element>
  <key>tip<\key>
  <val>tip<\val>
<\element>

<element>
  <key>tv<\key>
  <val>tv<\val>
<\element>

<element>
  <key>urn<\key>
  <val>urn<\val>
<\element>

<element>
  <key>uuid<\key>
  <val>uuid<\val>
<\element>

<element>
  <key>vemmi<\key>
  <val>vemmi<\val>
<\element>

<element>
  <key>view-source<\key>
  <val>view-source<\val>
<\element>

<element>
  <key>wais<\key>
  <val>wais<\val>
<\element>

<element>
  <key>ws <\key>
  <val>ws <\val>
<\element>

<element>
  <key>wss<\key>
  <val>wss<\val>
<\element>

<element>
  <key>xmlrpc.beep <\key>
  <val>xmlrpc.beep <\val>
<\element>

<element>
  <key>xmlrpc.beeps<\key>
  <val>xmlrpc.beeps<\val>
<\element>

<element>
  <key>xmpp<\key>
  <val>xmpp<\val>
<\element>

<element>
  <key>z39.50r<\key>
  <val>z39.50r<\val>
<\element>

<element>
  <key>z39.50s<\key>
  <val>z39.50s<\val>
<\element>

<\dictionary-elements>