<?xml version="1.0" encoding="UTF-8"?>
<dictionary-elements xmlns="urn:hu.sztaki.ilab.longneck:1.0"
  xmlns:xsi="http://www.w3.org/2001/XMLSchema-instance"
  xsi:schemaLocation="urn:hu.sztaki.ilab.longneck:1.0 ../dictionaryFileSource.xsd">

  <!-- Source : http://en.wikipedia.org/wiki/URI_scheme -->

<element>
  <key>adiumxtra<\key>
  <val>adiumxtra<\val>
<\element>

<element>
  <key>aim<\key>
  <val>aim<\val>
<\element>

<element>
  <key>apt<\key>
  <val>apt<\val>
<\element>

<element>
  <key>afp<\key>
  <val>afp<\val>
<\element>

<element>
  <key>attachment<\key>
  <val>attachment<\val>
<\element>

<element>
  <key>aw<\key>
  <val>aw<\val>
<\element>

<element>
  <key>beshare<\key>
  <val>beshare<\val>
<\element>

<element>
  <key>bitcoin<\key>
  <val>bitcoin<\val>
<\element>

<element>
  <key>bolo<\key>
  <val>bolo<\val>
<\element>

<element>
  <key>callto<\key>
  <val>callto<\val>
<\element>

<element>
  <key>chrome<\key>
  <val>chrome<\val>
<\element>

<element>
  <key>chrome-extension<\key>
  <val>chrome-extension<\val>
<\element>

<element>
  <key>coap<\key>
  <val>coap<\val>
<\element>

<element>
  <key>content<\key>
  <val>content<\val>
<\element>

<element>
  <key>cvs<\key>
  <val>cvs<\val>
<\element>

<element>
  <key>doi<\key>
  <val>doi<\val>
<\element>

<element>
  <key>ed2k<\key>
  <val>ed2k<\val>
<\element>

<element>
  <key>facetime<\key>
  <val>facetime<\val>
<\element>

<element>
  <key>feed<\key>
  <val>feed<\val>
<\element>

<element>
  <key>finger<\key>
  <val>finger<\val>
<\element>

<element>
  <key>fish<\key>
  <val>fish<\val>
<\element>

<element>
  <key>git<\key>
  <val>git<\val>
<\element>

<element>
  <key>gg<\key>
  <val>gg<\val>
<\element>

<element>
  <key>gizmoproject<\key>
  <val>gizmoproject<\val>
<\element>

<element>
  <key>gtalk<\key>
  <val>gtalk<\val>
<\element>

<element>
  <key>hcp<\key>
  <val>hcp<\val>
<\element>

<element>
  <key>irc<\key>
  <val>irc<\val>
<\element>

<element>
  <key>ircs<\key>
  <val>ircs<\val>
<\element>

<element>
  <key>irc6<\key>
  <val>irc6<\val>
<\element>

<element>
  <key>itms<\key>
  <val>itms<\val>
<\element>

<element>
  <key>jar<\key>
  <val>jar<\val>
<\element>

<element>
  <key>javascript<\key>
  <val>javascript<\val>
<\element>

<element>
  <key>keyparc<\key>
  <val>keyparc<\val>
<\element>

<element>
  <key>lastfm<\key>
  <val>lastfm<\val>
<\element>

<element>
  <key>ldaps<\key>
  <val>ldaps<\val>
<\element>

<element>
  <key>magnet<\key>
  <val>magnet<\val>
<\element>

<element>
  <key>maps<\key>
  <val>maps<\val>
<\element>

<element>
  <key>market<\key>
  <val>market<\val>
<\element>

<element>
  <key>message<\key>
  <val>message<\val>
<\element>

<element>
  <key>mms<\key>
  <val>mms<\val>
<\element>

<element>
  <key>ms-help<\key>
  <val>ms-help<\val>
<\element>

<element>
  <key>msnim<\key>
  <val>msnim<\val>
<\element>

<element>
  <key>mumble<\key>
  <val>mumble<\val>
<\element>

<element>
  <key>mvn<\key>
  <val>mvn<\val>
<\element>

<element>
  <key>notes<\key>
  <val>notes<\val>
<\element>

<element>
  <key>palm<\key>
  <val>palm<\val>
<\element>

<element>
  <key>paparazzi<\key>
  <val>paparazzi<\val>
<\element>

<element>
  <key>platform<\key>
  <val>platform<\val>
<\element>

<element>
  <key>proxy<\key>
  <val>proxy<\val>
<\element>

<element>
  <key>psyc<\key>
  <val>psyc<\val>
<\element>

<element>
  <key>query<\key>
  <val>query<\val>
<\element>

<element>
  <key>res<\key>
  <val>res<\val>
<\element>

<element>
  <key>resource<\key>
  <val>resource<\val>
<\element>

<element>
  <key>rmi<\key>
  <val>rmi<\val>
<\element>

<element>
  <key>rtmp<\key>
  <val>rtmp<\val>
<\element>

<element>
  <key>secondlife<\key>
  <val>secondlife<\val>
<\element>

<element>
  <key>sgn<\key>
  <val>sgn<\val>
<\element>

<element>
  <key>skype<\key>
  <val>skype<\val>
<\element>

<element>
  <key>spotify<\key>
  <val>spotify<\val>
<\element>

<element>
  <key>ssh<\key>
  <val>ssh<\val>
<\element>

<element>
  <key>sftp<\key>
  <val>sftp<\val>
<\element>

<element>
  <key>smb<\key>
  <val>smb<\val>
<\element>

<element>
  <key>soldat<\key>
  <val>soldat<\val>
<\element>

<element>
  <key>steam<\key>
  <val>steam<\val>
<\element>

<element>
  <key>svn<\key>
  <val>svn<\val>
<\element>

<element>
  <key>teamspeak<\key>
  <val>teamspeak<\val>
<\element>

<element>
  <key>things<\key>
  <val>things<\val>
<\element>

<element>
  <key>udp<\key>
  <val>udp<\val>
<\element>

<element>
  <key>udp<\key>
  <val>udp<\val>
<\element>

<element>
  <key>unreal<\key>
  <val>unreal<\val>
<\element>

<element>
  <key>ut2004<\key>
  <val>ut2004<\val>
<\element>

<element>
  <key>ventrilo<\key>
  <val>ventrilo<\val>
<\element>

<element>
  <key>webcal<\key>
  <val>webcal<\val>
<\element>

<element>
  <key>wtai<\key>
  <val>wtai<\val>
<\element>

<element>
  <key>wyciwyg<\key>
  <val>wyciwyg<\val>
<\element>

<element>
  <key>xfire<\key>
  <val>xfire<\val>
<\element>

<element>
  <key>xri<\key>
  <val>xri<\val>
<\element>

<element>
  <key>ymsgr<\key>
  <val>ymsgr<\val>
<\element>

<\dictionary-elements>